,code,name,subject_type,num_credits,period,course,language,content,mention,url,bibliography
13,104359,Diseño de Algoritmos,Obligatoria,6,2,2,Español,"ContenidoEl temario de la asignatura será:Tema 1. Repaso de conceptos básicos (Pre-condiciones, post-condiciones, invariantes y recursividad)Tema 2. Algoritmos de búsqueda. Taxonomía y estrategias.Tema 3. Backtracking.Tema 4. Branch & Bound.Tema 5. Programación dinámica.Tema 6. Greedy.Tema 7. Algoritmos estocásticosTema 8. Análisis de algoritmos.",,https://guies.uab.cat/guies_docents/public/portal/html/2019/titulacio/2503758/assignatura/104359/es,"BibliografíaFundamentos de Algorítmia, G Brassard P. Bratley. Prentice Hall.Técnicas de Diseño de Algoritmos, Rosa Guerequeta y Antonio Vallecillo.Técnicas de diseño de algoritmos, F. Perales, M. Mascaró. Universitat de les Illes BalearsKarumanchi, Narasimha. ""Algorithm Design Techniques: Recursion, Backtracking, Greedy, Divide and Conquer, and Dynamic Programming."" (2018).Chun, Wesley. Core python programming. Vol. 1. Prentice Hall Professional, 2001."
14,104347,Estructuras de Datos,Obligatoria,6,1,2,Catalán,"Contenido0. IntroducciónObjetivos y presentación de la asignatura. Repaso de Programación avanzada.1. Estructuras de datoslinieals.Listas, colas, pilas.Representación y manipulación de estructuras de datos dinámicas: repaso de listas, introducción a las pilas y colas.2. Estructuras de datos no lineales.hashTécnicas de ""Hashing"". Listas hash. Funciones hash. Como se implementan en python. Diccionarios.3. Recursividad yAlgoritmos de ordenaciónIntroducción a los algoritmos recursivos. Método de la burbuja, QuickSort, mergesort. Recursividad. Cálculo complejidad.4.Estructuras de datos no lineales.grafosRepresentaciones y recorridos. BFS, DFS, Resolución de problemas con grafos.5.Estructuras de datos no lineales.Árboles.Definición y representación de un árbol. Recorridos de árboles es. Binary Heaps.",,https://guies.uab.cat/guies_docents/public/portal/html/2019/titulacio/2503758/assignatura/104347/es,"BibliografíaProblem solving with algorithms and data Structures using Python. Bradley N. Miller and David L. Ranum. Franklin, Beedle and associates, 2005.Python Programming: an introduction to computer science. John Zelle. Franklin,Beedle and associates, 2004.Data Structures and Algorithms in python. Michael T. Googrich, Roberto Tamassia, Michael H. Goldwasser. Ed. Wiley. 2013."
15,104341,Ingeniería del Rendimiento,Obligatoria,6,1,2,,"Contenido1. Evaluación del Rendimiento: herramientas para monitorizar e instrumentar la ejecución de un programa.2. Análisis del Rendimiento: complejidad computacional, factores determinados por la arquitectura del procesador y métricas de rendimiento.3. Paralelismo en la ejecución de Instrucciones: Pipeline y Vectorización.4. Análisis de Dependencias de datos en los lazos de ejecución.5. Jerarquía de Memoria y Localidad de acceso a los datos: efecto en el rendimiento.6. Estrategias algorítmicas de optimización: aumentar el paralelismo y la localidad de acceso a los datos.",,https://guies.uab.cat/guies_docents/public/portal/html/2019/titulacio/2503758/assignatura/104341/es,"BibliografíaComputer Architecture: A Quantitative Approach.  6th EditionJohn Hennessy and David Patterson, Morgan Kaufmann (Elsevier) 2018 (Cap. 1-3)Computer Systems: A Programmer's Perspective. 3rdEdition (Nort-American)Randall E. Bryant and David R. O'Hallaron, Addison Wesley, 2015 (Cap. 5 i 6)Computer Organization and Design RISC-V Edition: The Hardware/Software Interface.David Patterson and John Hennessy, Morgan Kauffman (Elsevier), 2017 (Cap. 4 i 5)"
16,104346,"Procesamiento de Señal, Imagen y Video",Obligatoria,6,2,2,Español,"Contenido1.  Introducción al tratamiento de la señal, imagen y vídeo2.  Formación de la imagen3.  Procesamiento de imágenes4.  Filtrado lineal (espacial)5.  Filtrado frecuencial6.  Filtrado no lineal7.  Transformaciones geométricas8.  Segmentación9.  Características10. Clasificación11. Movimiento12. Aplicaciones13. Deep Learning",,https://guies.uab.cat/guies_docents/public/portal/html/2019/titulacio/2503758/assignatura/104346/es,"BibliografíaRafael C. Gonzalez and Richard E. Woods, Digital Image Processing (3rd Edition), Prentice Hall 2007.Simon J.D. Prince, Computer Vision: Models, Learning, and Inference, Cambridge University Press, 2012.(http://www.computervisionmodels.com/)David A. Forsyth and Jean Ponce, Computer Vision: A Modern Approach (2nd Edition), Prentice Hall 2011.Richard Szeliski, Computer Vision: Algorithms and Applications, Springer (Texts in computer Science) 2011. (http://szeliski.org/Book/)Ian Goodfellow and Yoshua Bengio and Aaron Courville, Deep Learning, MIT Press, 2016. (http://www.deeplearningbook.org)Aurélien Géron, Hands-On Machine Learning with Scikit-Learn & TensorFlow, O'Reilly, 2017.Joan Serrat, Llibre d'apunts de Processament d'imatges, 2006. (libro)Cursos similares y complementarios onlineCurso online (MOOC Coursera): Image and video processing: From Mars to Hollywood with a stop at the hospital. (https://www.coursera.org/course/images)Curso online (MOOC Coursera): Detección de objetos (UAB). (https://www.coursera.org/learn/deteccion-objetos)Curso online (MOOC Coursera): Fundamentos del Procesamiento de Vídeo e Imagen Digital. (https://www.coursera.org/course/digital)Curso online (MOOC Coursera): Clasificación de imágenes: ¿cómo reconocer el contenido de una imagen? (UAB). (https://www.coursera.org/learn/clasificacion-imagenes)Curso online (MOOC Edx ): Introducción a la visión por computador: desarrollo de aplicaciones con OpenCV. (https://www.edx.org/course/introduccion-la-vision-por-computador-uc3mx-isa-1x)Curso online (MOOC Udacity ): Computational Photography.(https://eu.udacity.com/course/computational-photography--ud955)Curso online (MOOC Coursera): Machine Learning. (https://es.coursera.org/learn/machine-learning)"
17,104356,Programación Paralela,Obligatoria,6,2,2,Catalán,"ContenidoTema 1: Introducción a sistemas de altas prestaciones.Introducción a los sistemas de altas prestaciones, sistemas paralelos, multiprocesadores y multicomputadores. Ejecución de aplicaciones paralelas en sistemas de altas prestaciones.Tema 2: Clasificación de paralelismoSIMD (Single Instruction, Multiple Data), MIMD (Multiple Instruction, Multiple Data). Modelos de aplicaciones paralelas.Tema 3: Algoritmos paralelosDefinición de algoritmos paralelos. Ejemplos de algoritmos paralelos. Desarrollo de algoritmos paralelos.Tema 4: Programación paralelaParadigmas de programación paralela. Aplicaciones basadas en paso de mensajes. Estándar MPI (Message Passing Interface). Aplicaciones basadas en memoria compartida. Estándares OpenMP (Open multiprocessing) y OpenACC (Open Accelerators). Paralelismo en Python. Desarrollo de aplicaciones paralelas utilizando MPI, OpenMP, OpenACC y Python.Tema 5: Análisis de prestacionesAnálisis de prestaciones de sistemas paralelos. Evaluación de prestaciones de sistemas paralelos. Ejemplos de herramientas de evaluación de prestaciones.",,https://guies.uab.cat/guies_docents/public/portal/html/2019/titulacio/2503758/assignatura/104356/es,"BibliografíaParallel Programming Concepts and Practice. Bertil Schmidt, Jorge González-Domínguez, Christian Hundt, Moritz Schlarb. Morgan Kaufmann, 2018An Introduction to Parallel Programming, 2nd edition. Peter S. Pacheco. Morgan Kaufmann. 2018Programming Massively Parallel Processors, A Hands-on Approach. David B. Kirk, Wen-mei W. Hwu. Morgan Kaufmann. 3th Edition. 2018Computer Architecture. A quantitative approach. John L. Hennessy, David A. Patterson. Morgan Kaufmann. 6a edición. 2018Introduction to Parallel Computing. A. Grama et alter. Addison Wesley, Second Edition, 2003.Parallel Program Development For Cluster Computing: Methodology, Tools and Integrated  Environments. Edited by J. C. Cunha, P. Kacsuk, S. C. Winter. Nova Science Publishers, Inc., 2001.Parallel Programming with MPI, Peter Pacheco, Morgan Kauffman, 1996OpenACC Programming and Best Practices Guide (https://www.openacc.org/sites/default/files/inline-files/OpenACC_Programming_Guide_0.pdf)"
18,104354,Teoría de la Información y de la Codificación,Obligatoria,6,2,2,Catalán,Contenido1.- Conceptos básicos. Fuentes discretas sin memoria.1.1.- Los problemas de la comunicación.1.2.- Medida de la información.1.3.- Modelo de Shannon de fuente discreta sin memoria.1.4.- Función entropía.1.5.- Información mutua.1.6.- Canales discretos sin memoria. Capacidad.2.- Codificación de la fuentee.2.1.- Introducción y objectivos.2.2.- Códigos de longitud constante.2.3.- Códigos de longitud variable. Decodificación única.2.4.- Cotas de Shannon.2.5.- Construcción de códigos óptimos.3.- Compresión de datos.3.1.- Tipos de compresión. Medidas de compresión.3.2.- Técnicas de compresión.3.3.- Métodos estadísticos.3.4.- Técnicas de diccionario.3.5.- Compresión de sonido y de imágenes.4.- Canales discretos sin memoria.4.1.- Modelos de canales.4.2.- Cálculo de la capacidad de un canal.4.3.- Reglas de decodificación.4.4.- El teorema fundamental.5.- Teoría de la codificación I: códigos lineales.5.1.- Códigos bloque. Decodificación a mínima distancia.5.2.- Introducción a los cuerpos finitos.5.3.- Códigos lineales. Matrices generadoras.5.4.- Códigos equivalentes. Codificación sistemática.5.5.- Códigos duales. Matrices de control.5.6.- Decodificación. Tabla estándard y síndrome.5.7.- Algunas familias de códigos lineales importantes.5.8.- Aplicación al almacenamiento distribuido.6.- Teoría de la codificación II: códigos cíclicos.6.1.- Códigos cíclicos como ideales de anillos de polinomios.6.2.- Polinomios generadores y de control.6.3.- Codificación sistemática con códigos cíclicos.,,https://guies.uab.cat/guies_docents/public/portal/html/2019/titulacio/2503758/assignatura/104354/es,"Bibliografía*L. Huguet i J. Rifà. Comunicación Digital. Ed. Masson, 1991.*D. Salomon: Data compression - The Complete Reference, 4th Edition. Springer 2007.*R.B. Ash. Information Theory. John Wiley and Sons Inc, 1965.*G. Alvarez. Teoría matemática de la información. Ediciones ICE, 1981.*T.C. Bell, J.G. Cleary i I.H. Witten. Text Compression. Prentice Hall, 1990.*F.J. MacWilliams and N.J.A. Sloane. The theory of error-correcting codes. North-Holland, Amsterdam, 1977."
